lang,text
es,Estas son las y mejores plataformas que conozco de inteligencia artificial Número de Chad Repite y yo creo que ya todos la conocemos Y básicamente te resuelve cualquier cosa escrita Número de Tomar pp Esta plataforma tú le dices créame una presentación de cualquier cosa y en menos de de segundos crea la presentación e incluso con imágenes Número de Con tesis Esta plataforma te convierte de texto a voz y te pone un personaje que parece una persona real echa base de inteligencia artificial que incluso articula el texto que tú pusiste con forma pasándose a voz Número de Mijo rey Esta plataforma te crea arte digital desde de Tú le dices créame un tren en una estación de noche color negro con dorado y que tenga el logo de bizco y al frente y te lo crea en segundos Y la de ve la en mi canal de Y octubre y El entre mi perfil no te lo pierdas
en,The outcome of this election is not what we wanted not what we fought for not what we voted for but hear me when I say Hear me when I say The light of Americans promise will always burn bright As long as we never give up and as long as we keep fighting
en,Holy press
en,I'm having your bed There's a place you can god I'll stay young man When you're sure you know you can stay there And I'm sure you might be waiting It's fun to stay at the Ymca
en,President like of brand new think
es,Duna el toma ha logrado una victoria decisiva en las elecciones presidenciales de 2024. Regresando la Casa Blanca tras derrotar al actual vicepresidenta Camada Haréis con más de y de votos Disco sin se dio el triunfo del republicano quien tiene así y de votos electorales de acuerdo con la agencia a Siete Prensa Haréis en ese momento tenía de de aunque quedan por definirse estados como Mochila no Nevada Atizona y Alas a en todos ellos la tendencia favorezca Trampa En una contienda que dividió profundamente al país el ex presidente republicano supera Haréis en un enfrentamiento polarizado que reflejara atención política y social que ha caracterizado su carrera Solitaria marcó el regreso de una figura controvertida que tras derrota en de de volvía movilizar a una base de votantes dispuestos a darle una nueva oportunidad para gobernar Trama regresa acompañado por el triunfo de los republicanos en el Senado donde tendrá mayoría Está pendiente en recuento final de la cámara de representantes que por ahora favorezca los republicanos y de contra de de la victoria de Trama tras derrotar en de de marcó un cit en la política estadounidense con un regreso que ya está generando una gran expectación sobre cómo gobernará en un país más polarizado que nunca
es,Si algo ha hecho bien este gobierno de verdad impuestos Era lo que tía a preguntar grey que pongo con el Mata y O sea para el emprendedor para el empresarios qué hoy está viviendo una época en donde antes Comprado a una factura y ya no había pedo Comprado a factura pues legal No debamos Sí pero no lo hagan manguito se Aprovecharon la anemia y aprovecharon las ventajas de la tecnología Todo lo que haces está ya en un sistema Es una huella digital Tiene o sea todo está en un sistema veo católicos qué hicieron Oye el Za invirtió en software de inteligencia artificial Agarran todo la información que tienen Método y pinches software de inteligencia artificial que te cruza a toda esa información Y lo que hacen es inmediatamente cuando detectan algo te mandan un requerimiento y te mandan un requerimientos Y te mandan un requerimientos Entonces qué hace a la gente esas usted hacer No quiero pagar un caso Y la gente automáticamente pagar grey Y lo sumaron el tema de las entrevistas virtuales
es,"Malas noticias para los inmigrantes estas son las reformas migratorias de Trama para Estados Unidos Trama ha presentado una serie de medidas firmes para tratar la problemáticas de la inmigración Una de las propuestas es deportación en masa destinada entre las de y de millones de inmigrantes sin documentos a pesar de que el número preciso ha generado controversia el Peri Seco se ante calcula que la cantidad de inmigrantes sin documentos ascendía cerca de de millones en 2022, a pesar de estos números Trama continúa sosteniendo la importancia de una intervención que en Cederé villa otro aspecto clave de su política migratoria es la utilización de la Guardia Nacional y incluso del Ejército En caso de ser necesario para llevar a cabo las deportaciones Trama sostiene que no sería una infracción a las leyes que impiden la utilización militar contra civiles sosteniendo que estos no son civiles Son individuos que no se encuentran legalmente en nuestro país es una invasión a nuestra nación Pero en un giro inesperado Trama ha propuesto otorgar de manera automática la tarjeta de residencia a ciudadanos extranjeros que se gradual de universidades estadounidenses la implementación de la ley de enemigos extranjeros y la opción de utilizar al Ejército para implementar las normativas migratorias son dos de las acciones más polémicas Estas propuestas no solo han suscitado críticas por su radicalizado sino que también generan incertidumbre Acerca de su factibilidad legal y los gastos financieros que conllevaría qué opinas"
es,Están las noticias de que ganó el presidente Trampa pero de todas maneras nosotros vamos a esperar el día de hoy a que termine en algunos estados de contarse y poder dar ya el comunicado oficial Vamos a esperar todavía el día de hoy a ver cómo avanza los estados que faltan y también por la posición de ambos candidatos Ya se manifestó el presidente Trampa pero es prudente esperar a todas y todos los mexicanos No hay ningún motivo de preocupación a nuestros paisanos y paisanas a sus familiares que están aquí a las empresarias y a los empresarios mexicanos No hay motivo ninguno de preocupación México siempre sale adelante somos un país libre independiente soberano y va a haber buena relación con los estados sonidos con vencida de ellos
en,So as President I'll not only restore that tax cut but expand it We will provide of of of in tax relief to families during the first year of a child's life Now think what that means Think what that means That is a vital vital year of critical development of a child And the cost can really add up especially for young parents who need to buy diapers and clothes and a car seat and so much else And we will do this while reducing the deficit Compare my plan with what Donald Trump intends to do He plans to give billionaires massive tax cuts year after years And he plans to cut corporate taxes by over of trillion even as they pull in record profits And that's on top of the of trillion tax cut He already signed into law when he was president which by the way overwhelmingly went to the wealthiest Americans in corporations and exploded the national deficit You know I think that if you want to know who someone cares about look who they fight for
en,What is it that she's fallen for What is the There's too many people here People that are that are brown or raping everybody and I'll just just just horrific She thinks that Labor is bringing in she shall re which she said to me yesterday Well it was Sharia last week I'm not Sharia Shiver a Shiver a last years She has called it Shiver a as well When I've asked her what's that about We try and ask her question We try and use your tactics What sort of people is she I've mentioned one Not your fridge Yeah really Not your fridge Trump Yeah She just reports and I think what happens with the Alarm um you know you just you see one thing and then you I've actually looked on her Tito and I was just disgusted
en,a contact angel
en,I have never seen the crowd at a Trump rally as confused and as bored as the crowd was last night during Donald Trumps Montana rally where his cognitive decline was on full display Now you guys have probably noticed it as well but over these past two or three weeks Donald Trump has become especially unhinged basically since the day that Vp Harris took the mantle and began running Donald Trump has been declining at the Nabob He broke down on stage in front of some black journalists A few days ago he held a press conference where he was whining the entire time and the cherry on top was this rally last night where I want you to watch his crowd throughout I'll point it out we can break down some of his racist attacks against Vp Harris His desperate struggle to find anything to attack Vp Harris and Sam Watson also his obsession with attacking President Biden even though Biden isn't running So in this first clip Trump makes it very very clear that he has nothing solid against Vp Harris He's genuinely destroying stuff at the wall and seeing what sticks Notice how desperate he sounds during this of Well she has a couple of things that a lot of people from Montana would like Like she wants to take away your guns You like that right Oh alright how about this She wants to defend the police Are you okay with that He is really losing his spark Let me point out I means in of of he did have a different level of energy than we see today on stage He seems a lot more tired He's slurring a lot more He doesn't seem to have that oomph behind what he's saying She wants to allow millions of people to pour into our border through an invasion using an invasion process I don't think so Using an invasion process He also seems a lot more mad and angry He seems like an old grandpa who's lecturing their grand kids rather than somebody who's giving a speech to his supporters I don't think that's for you It's not for me either It's not for most people in this country We're going to evict crazy Kampala do We're going to of He has nothing They're so desperate to find anything Anything to attack Vp Harrison because the reality is Kampala and Tim Walls are the normal people I think the electorate is starting to notice that And notice Donald Trump as the radical lunar e who's slurring his way through speeches And can't go one second without making some sort of racist or sexist remarks But in this next clip This really highlights of
en,Oh hand Song Vikings The alright what do I do
en,And I've often said the happiest people and the most contented people that I've seen And I know the very wealthy I know the moderately wealthy and I guess I know people a lot less than that But the happiest people tend to be the people that are making a nice income that really enjoy their life and their family life and not the people of tremendous wealth that are constantly driven to achieve more and more success But when is enough enough Obviously there must have been a time of point when you knew that you would be secure for the rest of your life your family your relatives whomever Why do you go on I go on really because I enjoy it I really enjoy when I think about my business I think about it literally of hours a day And I really enjoy it If I didn't I will stop There's no question in my mind that I'll stop Because I do understand it's all basically a game We're all here to play the game and we're all hopefully going to play it well But some people obviously can play it well because if everyone played it well you'd have a pretty unusual situation But the game is being played now by me and by plenty of other people And the people that enjoy it are the people that are going to win it in my opinion
es,La carrera presidencial de los Estados Unidos se puso súper interesante y es que desde que Camada Haréis tomó el lugar de Je Bien en la candidatura del Partido Demócrata las cosas se complicaron para donar Trampa De hecho la mayoría de las encuestas apuntaban a que Trama regresaría a la Casa Blanca tras las elecciones de noviembre Pero qué creen Y los republicanos magas no contaban con la estudia de Camada Haréis Con decirte que el cambio en el ambiente electoral de los Estados Unidos puede tal magnitud que hasta las encuestas señalan que Camada ya le dio la vuelta a Trama en las preferencias electorales Checa lo que dicen los agregado es para la presidencia de los Estados Unidos al de de agosto Por ejemplo Tena los Times comparte un promedio de las encuestas nacionales y dice que Hay lidera las preferencias con y de sobre un y de de Trampa Por otro lado tenemos el promedio de encuestas de Real Cuerpo litis Ellos también ponen a Camada como la líder de las preferencias con un 47.6%. Mientras que Trama se mantiene pegado con un 47.1%. Por último tenemos el promedio de encuestas de Parte Reino que teniendo en cuenta la actualidad de cada encuesta en tamaño de la muestra la metodología y los efectos de las cámaras Camada Haréis también se encuentra sobre Trama en esta medición con un y de contra un de de Así que como puedes ver la contienda en Estados Unidos va a estar más cerrada de lo que pensaban Y el encuentro entre Camada Haréis y Dona Trama dará mucho de que hablar Obvio la información de todas las encuestas la podrás encontrar en Pulse Meses
en,I'm not supposed to be here tonight I'm not supposed to be here But I'm not
es,cómo va la carrera de sector ar en Estados Unidos Las elecciones presidenciales en nuestro país y no están más cerradas que nunca La candidata demócrata cámara la Javier s acaba de rebasar en las encuestas al republicano Dona Trampa y es que según datos del Real Crear Politice Javier s tiene el de de de votos electorales por el de de de Trampa Es decir una diferencia de un punto porcentual Puede parecer un número muy bajo sin embargo recordemos que cuando yo va a ir en debajo de la candidatura la diferencia de tres votos porcentuales en favor de Trampa Otras casas encuestadoras como Delitos da ventaja de cuatro puntos para Haréis Ras mus reporte da ventaja de cinco puntos para Trampa Recordemos que las elecciones presidenciales no se definen por la cantidad de votos ciudadanos sino por la suma de votos del colegio electoral en cada estado Es decir quien tenga y de se convertían el nuevo presidente de Estados Unidos qué opinas de esta cuestión Sigue nos para más noticias
en,I break as a horse and my egos another I beg you don't embarrass me Motherfucker
en,A man has claimed he warned police about a gunman three minutes before Donald Trump was shot Speaking to the Bbc the witness said he was confused about why Trump was still speaking and hadn't been pulled off stage He said he noticed the shooter air crawling up the roof of feet away from him One person was killed and two others were critically injured in this assassination attempt in Pennsylvania The Secret Service said Matthew Thomas Crooks the year old suspect was neutralized immediately
en,My parents did You know we did a good job And you're a handsome guy Come on let's god That's a key part That's my house So once again the photo is messing up We'll go this way That's so Thank you
en,His Mr Trump I was Mrs Wisconsin Usa I can see why Thank you I've been struggling with an incurable illness and in the hospital I received from you a handwritten letter that said to the bravest woman I know I remember that It's such a wonderful beautiful woman Are you coming along okay No sir but that's okay and I wanted to thank you I have a seven year old son because of your efforts It's sent him to college That's so nice Thank you We're going to be watching you boy Okay but you're going to hopefully be around You're not going to have to have anybody watching Those doctors are going to be so wrong I'm sorry I have to go down and say hello Is that okay
es,Hoy en Parlamento y debate daremos una breve visita a la cartelera política promueve a las elecciones en Estados Unidos de y de noviembre Haremos un resumen de lo corrido en el mes de cuyo y lo que va de agosto debido a la forma en los sucesos nos decidí mencionar de la siguiente manera política cámara acción El escenario Hollado o político electoral en los Estados Unidos se ha presentado tres grandes proyecciones la primera Terminar Trampa eso siendo un trillar de acción protagonizado por el principal actor Dona Trama y como coautores el servicio secreto ineficiente de los Estados Unidos y un joven tirador inexperto trata sobre el atentado a un pie candidato a la Casa Blanca Estuvo en cartelera diez días aproximadamente teniendo un rey tren muy aceptable Esta película está producida por Trama entre tenemos y
en,God What are you doing around here Just playing with me sorry Playing very good Yeah playing very good And now this is Stevens favorite Come on you wanted your industry to be with the booth I would like to
en,Black jobs who was talking about construction jobs laborers Welding Masons Carpenters if only there was a website Oh that's right the Department of Labor less all the statistics of who works what I'm gonna just annihilate my group African Americans account for of of of construction jobs while Hispanics hold down a of of Laborers are a of of African American while Hispanics are of of Welders of Hispanic folks of of Masons of of Hispanic people a of of Carpenters of of Hispanic people a of of It's almost as if this information is readily available but we just don't want to look at it unless it agrees with our narrative Google also has this really cool new feature where if you look stuff up it tells you So I look at jobs that are predominantly African American when it comes to the majority Healthcare support transportation security and law enforcement child care and social assistance and personal care and services So where are we going to put the goalpost now
es,El ex presidente estadounidense Dona Trampa en su mandato quería que le pintaban de nuevo la casa blanca y pidió tres cotizaciones contratista chino tres millones contratista europeos siete millones y contratista latino diez millones Después de un rato Trama le preguntó al chino por qué pedía tres millones El chino dijo un millón en pintura un millón en mano de obra y un millón de ganancias Luego le preguntó al europeo por qué pedía siete millones El europeo contestó tres millones en pintura de alta calidad dos millones en mano de obra especializada y dos millones de ganancias Finalmente le preguntó al latino por qué pedía diez millones El latino respondió donde Trama son tres millones para usted cuatro millones para mí y con los tres millones que sobran le pagamos al chino para que pinte
en,You got me sweaty blue many for your face damn You got me damn You got me damn
en,You're an immigrants Yes Do you ever think he's gone too far I follow the law I follow a law the way supposed to be I never thought to stay here without papers I had visa I travel every few months back to the country to Slovenia to stamp the visa I came back I applied for the green card I applied for the citizenship later on after many years of green card So I went by system I went by the law And you should do that You should not just say okay let me just stay here And what happened happens
en,I'm the fucking the fucking hands the hand to Show me the bath Show me the bat yet There we god Oh where is your name Oh my god Oh my god
en,I used to support Trump back in the day I didn't really know anything about him I just wanted to support him because all my other friends like Donald Trump So I was like okay I'll like Donald Trump Like it was like a band marked things Now hear me out Um I know I look like a circus clown right now Just just process I went to a predominantly white high school middle school in elementary school Like seeing a black person was like extremely rare at my school Like there was no diversity Okay The coolest thing you could be like in my middle school and high school that I went to was literally a Republican a conservative Republican at that So why not follow the band legged And then everyone always used me as that one excuse That one friends If somebody was like oh like you're supporting Trump your racist I'd be like not I'm not I'm French and Julianne Guilty I literally looked so dumb And I thought like finally all the white people at my school liked me Not They didn't like me They just liked that I liked what they liked I didn't know Trump was bad until one time in my social studies class We were watching the Cnn news Like it was like a of minute news things We were watching it And afterwards I literally I clapped because Donald Trump was on the Tv I clapped Nobody else even clapped Like I was so pick me like choose me Love me If you couldn't fucking tell I wanted to fit in So fucking bad I think we've established that So yeah I clapped So when I clapped everybody looked at me and they were like and I was like whatever losers Not I was the losers I was the biggest loser of them all So my friend comes up to me after class and she's like why do you like Donald Trump Like you're literally a minority And I was like cut I love him Because everybody else likes Donald Trump Like why don't you like Donald Trump Like what's the team So my girlfriend finally like explains to me how Trump is racist He's a piece of shit Like he's just a horrible person And I was like oh yeah I didn't get that information And of course I did it Why would these white conservative Republicans s people that I was friends with tell me all the like all the terrible things that he's done and the bad human being that he is Why would they do that You are who you're surround yourself with And when I was younger I surrounded myself with a bunch of Nimrods and idiot sandwiches So I ended up like this So once I found out he was a racist piece of shit um of course I stopped supporting him And one of the most embarrassing things about supporting Trump was I literally used to have like a Trump sticker on my school laptop And when I would come home my mom would rip it off every time and I would really ask my conservative friends to give me more Trump stickers because my mom kept ripping it off Like as she said because we're immigrants And like I don't even know why like Trump because Trump didn't even like me like especially me It is with great pleasure that I announced that I obviously do not support him anymore I haven't in like almost of years like he's scary I assume you realize the best thing you could do for yourself is to just form your own opinion And also the best quality to have is being educated Nobody likes a dumb bitch It was me I was a dumb bitch Nobody liked me This would be smart Be educated It's the sexiest thing a woman can be educated Okay Bye
en,Walk away from arguments that lead you to anger and nowhere Walk away from people who deliberately put you down Walk away from the practice of pleasing people who choose to never see your worth Walk away from any thought that undermines your peace of mind Walk away from judgmental people they do not know the struggle you are facing and what you have been through Walk away from your mistakes and fears They do not determine your fate The more you walk away from things that poison your soul the healthier your life will be When people make you feel unwanted don't leave to make them feel sad or guilty They won't leave because you no longer have a reason to stay Sometimes you have to be strong for yourself What is meant to be will end up good and what is not wrong Love is worth fighting for But sometimes you can't be the only one fighting At times people need to fight for you If they don't you just have to move on and realize what you gave them was more than they were willing to give you
en,multinational
en,When Trump said that migrants are stealing black jobs we know the type of jobs he was thinking about is like this this this this But these are stereotypes But you know what I'm here at the with Grand Conclave in Vegas idea the th of our charity We're better placed to ask what type of jobs we African Americans have Because obviously it's not the stereotypes What do you do for a of We tire more York City principle What do you do for living I work in sales in Columbus Ohio What do you do for living I do technical sales I build a pump up safety network I'm a supervisor for a catering company for the airlines so I make sure everyone is safe from going home all night I saw a quenching lift came to space and turned it We work for the District Government I'm an It guy for health and nonhuman I'm an It project coordinator at the Oman Tech University I'm a software manager Sales I'm an It Is agent better related and a polygraph examiner for them I work with nonprofit organizations support standards and individuals We're neighbors experience some level of trouble in the script I'm an App program management manager project managers business and this all over the world I am the chief meteorologist for Telemann do and for the Nbc affiliate and Delaware Good question What's up What do you do for living I work for all of my wrestling world What do you do for living I work for social media I work for a students I work for a student at Jesse Bitter County University What do you study I'm a psychology and I work for a students I work for a student at the University of Illinois I'm a school teacher I'm an Actor B professor a physics professor I work at United States Military Academy in the admissions department I'm a retired colonel United States Army of years I'm a professional I'm a self employed gas I am a physician I do sports medicine occupational medicine I work in a rich poor Virginia area I currently attend the United States Military Academy and I'm in the second degree of medicine I'm in the United States Army Sam Ten was born and God loves an infantry
