lang,text
en,Trump revealed a new economic policy that hard working Americans are going to love You know people are saying to themselves where we better off four years ago or we better off now and it wasn't even close We had the greatest economy in history what we did in taxes nobody ever done it So this is the first time I've said this and for those hotel workers and people that get tips you're going to be very happy because when I get to office we are going to not charge taxes on tips people making tips Now when I was a bell hop they paid me about a of an hour but I made hundreds of dollars in cash tips which we didn't report obviously because they can tax it but everything on credit cards now You can't hide it Uncle Sam tax his tips Biden hired of of of extra Irs agents gave him guns to do it Trumps tip tax cut makes Biden look like a sinister old glaser Sources in Delaware tell me Widens a terrible tipper Usually he has somebody else pay for him but when he does pay no boy no a bad tipping president who taxes tips doesn't get reelected
en,The reason why I voted for Trump is because I actually was a fellow for the Democratic Party And so I just really did not like Hillary Clinton I actually also did a lot of community work for Bernie Sanders as well And I don't know I was in this I literally sat in the voting booth for like it was a long time And I don't know I just like checked the box Honestly I thought it was I honestly didn't even think he was going to wind So part of it was kind of a joke But again In again I don't know But before I speak to the privilege that that holds for that election to be a joke for you right I wasn't really a joke I was like you know just set it Well let me let me let me let me recant when I met by a joke you know I didn't like either party you know I think it was like if Bernie Sanders was on the ticket I would have voted for Bernie Sanders because I really did at the time really love what he said what he stood for because you know he really did a lot of grassroots And I related to him as a Jewish American And I thought that socialism was the answer And then you know but then what happened with Hillary Clinton when she stole the election from him you know I just couldn't vote for her she was a woman So I did vote for Trump Why not write in Because that's not that's wasting a vote But it was a joke vote So we're really like okay right
es,sabes por qué Dona Trama odia México Resulta que en de de Trama organizó el concurso mis universos en México ciertamente el que en ese entonces era propietarios y aunque el evento resultó todo un éxito tres años después de mando a la empresa comercializado la Ronda y propiedad de la empresa pero mejicanos Adolfo Rosas Moya por incumplimiento de contrato Dejó Trama se había acordado que dicho empresa financiera el concurso de belleza sin embargo como esto no sucedió el magnate pidió como compensación que a Rosas Moya le embargaron de propiedades en playa del Carmen que habían sido puestas como garantía Pero en principio el Tribunal concedió al ex presidente de las propiedades pero poco después Rosas Moya interpuso un amparo ganó el caso y la recuperó Así está derrota fundó un golpe para Trampa por lo que muchos aseguran que contribuye al resentimiento que tienes a los mexicanos Ya vez destacar que esta no es la única polémica de Rosas Moya este mismo años ocupado por el también empresario Fernando Garnacha no de embargar de forma ilegal sus propiedades en Yuca tan con el respaldo del gobernador del Estado el pianista Mauricio Vida Y ya es conocer más sobre esta trama de corrupción checa nuestro canal de Y octubre y
en,more border patrol and more I'm sorry I'm off What is he talking about I really don't know what he said at the end of that sentence I don't think he knows what he said either We had the safest border in the city And let him finish the job He doesn't want to do it He's become like a Palestinian But they don't like him because he's a very bad Palestinian He's a weak one President Biden you have a minutes I means I don't know how much foolish this is Not only pushing these stages of convicted for his male and looking up right now And the fact that the matter is he isn't He cooked them Not he cooked them Unfortunately he cooked them But when he talks about a convicted fellow his son is a convicted fellow At a very high level his son is convicted He's been convicted probably numerous other times Should have been convicted before but his justice department let the statute of limitations laps in the most important things But he could be a convicted fellow in the city As he gets out of office he'll have to be a convicted fellow with all of the things that he's done My son was not a losers He was not a sucker You're the sucker You're the losers And by the way about the punch of minutes face is that Look how mad he is Brow Trump is just showing this guy right now Brow look at the smirk on his face
es,Escucho usted del ex presidente de Estados Unidos Dona Trama le ha solicitado a la corte de Nueva York que retirasen su sentencia hasta después de las elecciones presidenciales del mes de noviembre según la carta enviada por sus abogados sentencia a Trama antes de la contienda pues sería una interferencia electoral dicen Los abogados pidieron este retraso para que Dona Trama pueda considerar los próximos pasos traer la posible decisión del juez Juan Marchan sobre la solicitud de la defensa para anular el veredicto y desestimar el caso El y de noviembre es el día de las elecciones pero muchos estados permiten votar antes de esa fecha Si Dona Trama es condenado en el mes de mayo por falsificar registros comerciales esto podría influenciar en el voto de las personas Ustedes que opinan
es,Vigas se retira y Camada Hay centra a la contienda Pareciera una luz de esperanza contra las terroríficas propuestas racistas de Trampa pero de verdad Hay no haría un gobierno racista Después de canalizar miles de millones de dólares a una guerra indirecta en Ucrania y a un genocidio en Gaza el partido demócrata intenta salvar sus posibilidades de ganar las elecciones en noviembre de este año y su apuesta se llama Camada Hay y quién es ella en verdad A simple vista podríamos ver a Hay como un perfil progresista una mujer demócrata hija de padres migrantes de India y Jamaica Camada tuvo la intención de presentarse en de de a la presidencia de los Estados Unidos pero las encuestas no la favorecían Después de la asesinato de Jorge Flor de algunos demócratas y progresistas se solidarizaron con el movimiento anti policial Hay era conocida por sus políticas severas en California políticas racistas que utilizaban la justicia selectivamente Así se ganó su título de Camada de Copa Camada policía título que no brillaba entre la gente con una postura anti policial En resumen su imagen no era lo que buscaba la población de centro derecha en de de y definitivamente no era lo que buscaban los demócratas en ese momento Camada se retira de la contienda y fue elegida como vicepresidente por de dado de Je Bien Durante su periodo sus mayores esfuerzos giraron alrededor de detener la migración del sur global hacia Estados Unidos Es importante mencionar que la mayor parte de la clase dominante y los grandes críticas capitalistas de Estados Unidos no quieren al impredecible de Dona Trama y apoyan a Camada porque esta representa la estabilidad económica para ellos Al ser Camada vicepresidenta su elección tiene tintes de una reelección y de continuidad Así Camada seguiría con el legado de Bien y un legado que no aprobó un solo proyecto de ley para mejorar la vida del pueblo estadounidense y un legado imperialista que ha dado forma al genocidio más grande del siglo Xi Camada sigue siendo el rostro del imperialismo Después de saber estos con demócratas o republicanos habrá forma de librarnos del racismo
en,Trump what is your favorite Christmas song My favorite Christmas song is O Holy Night And what is yours Mine is probably Jingle Bells Oh beautiful song Beautiful song So what's your favorite Christmas song
en,Nobody said to me the other day you're the most famous person in the world by far I said not I'm not Not I'm not He said yes you are I said not He said who's more famous I said Jesus Christ I'm not taking any chances I'm not going to have it on Hey I'm not having any arguments Jesus Christ I'm not going to take any chances I'll give it a guarantee You still need help from the boss We need help from the boss We need help Yeah we need help It's all right to say it Now they'll criticize me for that How dare he say that How dare he say that Not I'll say it I'll say it
en,What you doing is right and that you're really smart and like a lot of us are really smart and we're smart
en,The
en,After you become the with president what are you gonna do to stop the war in your Korean Yeah So I would literally start calling not from the day I took over but from the night I won And I'd call two people Two people You know the two people are Put in right You know Put in is Kerensky a Kerensky a And I'd say we're gonna meet We're gonna That's what we would say Here we get on the phone and here we god We're gonna meet And I would I guarantee I could work that I guarantee I know exactly what I'd say by the way I know exactly I tell one guy this and I tell one guy that and I say you better make a deal Trumps foreign policy ideas Extremely convincing to nine year old
es,Con holding Con investiga te Sin poner Son huir
en,This is the front page of the New York Times right now and isn't it just beautiful Democrats retain power in the Senate showing that Democrats officially have of Senate seats Nevada and Arizona have been called Pennsylvania has been called and Democrats won in all of them Now we just need to win the Georgia Senate runoff to get of seats and expand our majority
en,Abdul King
en,Eliminate taxes on tips for service and hospitality workers Because when I get to office we are going to not charge taxes on tips People making tips
en,Auntie
en,Amelia Harris needs to run her election campaign like a Taylor Swift album release and I'm being so serious Step number one she needs to delete her entire social media and un follow everyone blackout everything Step number two she starts posting a three part series that is going to reveal an announcement and is three pieces of a coconut tree Finally the last post has the caption there will be no coconut tree just the context of all in which she lived and what came before you Then later this months at the Democrat National Convention they need to start playing a video of all the bad things Donald Trump has said about Kampala Harris And it will sound exactly like the reputation stadium tour intro where slowly it says coconut tree coconut tree and it gets louder until that's all that it's saying And then all the music cuts and you heart you think you just fell out of a coconut tree Ha ha ha had And then it goes completely dark and black and you hear the beginning notes of ready for it And that's how she makes her entrance She comes on stage wearing coconut tree earrings and she steps up to the podium and delivers the speech of a lifetime Then throughout the rest of the campaign they still need to continue this strategy They need to leave Easter eggs They need to get people clues about who the vice presidential pick is going to be I want limited edition variants of all of her march I means seriously who is better at pushing something to winning when the race is really close They need to get tree pain on the case state
en,I just want to run it back though to the very beginning because this is something that I just can't get over I can't get over the gentle lady from South Carolina talking about white privilege It was a spin the face at least of mine as a black woman for you to talk about what white privilege looks like especially from that side of the aisle and let me quote your now used speaker in what he had to say about the Republican party and y'all lack of diversity When you look at the Democrats they actually look like American When I look at my party we look like the most restrictive country club in American So let me tell you something Y'all don't know what white privilege looks like but I'm going to show you a little bit of something You see you want to talk about a two tier justice system and this is the only time the child have ever referenced it when this country has a history when it comes to black and brown folk of having two separate sets of rules And right now what you want to do is have two separate sets of rules because Mr Moscow it z offered a fair situation He said he would vote for a hunter to be held in contempt if y'all voted to hold even if you remove all of the members of Congress There's still other people that y'all haven't decided that y'all have excuses for it but y'all don't want to hold them in contempt But for some reason it makes sense to hold hunter Biden in contempt who is tried to comply And let me tell you why nobody wants to talk to y'all behind closed doors because y'all lies That's just the bottom line You have done it thus far in this investigation You have done it this far as it relates to this committee and every single hearing y'all spin spin spin I don't know how y'all are still standing right now because you should be quite dizzy from all the spending that you're constantly doing when it comes to spinning the truth You talk about free and fair elections but you back a guy who we know tried to steal the election And this isn't about what Democrats have to say Let me remind you for those of you that don't know how the justice system works It's not a matter of the president went in and indicted Trump But we are talking about grand juries Grand juries are comprised of American citizens And the people that have entered pleas of guilty that will be flipping on your leader in a minutes they are Republicans I do want to point that out And half of them were Republicans that were handpicked by Donald Trump himself So to be clear whatever happens to your little leaders it's going to be because of the actions that he took So you can talk all you want to about how January a was nonsense but all of y'all were running At that time y'all were grabbing y'all gas masks and y'all were running to your offices because you didn't know if they were coming to kill you You should have cared that somebody was there to protect you But instead you want to play games because you found out that it was your leader that decided that he wanted to propagate an insurrection on our country So don't tell me that you care about the Constitution because you don't All you care about is Trump getting reelected and I'll yield the last of my time to my leaders Thank you
en,President what's you get So okay so I don't like you know music Okay so first of all Charlie Many as really one of the greatest jazz performers every One of my favorite albums of all times Roy Ayers Everybody Left Sunshine you know this one So good It's a classic And then for the best right And this is the beautiful one of the Alpha Stirs and the Lillie s strong So there you god
en,Good morning it's another day in the Congo and we've just made it to the city of Woman I took the night boat here across the lake for of hours and we've just arrived in Woman I'm so excited to explore the city It's another day in the Democratic Republic of the Congo I can already see it's a bustling mess out there in the harbor and I'm excited to explore the city So greetings from Woman
en,A quick reminder vote Go to will Vote com to find out where and how
en,Like he used him as his puppet and it exposed what many of us have been saying about Tucker Carlson He's a Kremlin puppet who doesn't know what the hell he's talking about It's just such a disgrace I think to our country that an American would give him any kind of platform to propaganda Wait if I may I'm amazed at the level of self projection going on here I means Alicia you work for Abc Tucker works for himself Objectively you are a puppet and he's not And Sonny you're basically saying that Tucker shouldn't be allowed to have a voice That's the opposite of the democracy that you preach every time we're here And finally none of you had any examples on what Tucker had said that was a lie or propaganda But I'm too nice so I will give you another chance Give me some specific examples to back your claims Let's god
